text,label,clean,token_count,sentence_count,tokens,sentences
میں آپ کو مشکل سے سن سکتا ہوں۔,,میں آپ کو مشکل سے سن سکتا ہوں۔,9,1,میں | آپ | کو | مشکل | سے | سن | سکتا | ہوں | ۔,میں آپ کو مشکل سے سن سکتا ہوں۔
چھپے ہوئے تھے,,چھپے ہوئے تھے,3,1,چھپے | ہوئے | تھے,چھپے ہوئے تھے۔
زین نے ہتھیار ڈال دیئے۔,,زین نے ہتھیار ڈال دیئے۔,6,1,زین | نے | ہتھیار | ڈال | دیئے | ۔,زین نے ہتھیار ڈال دیئے۔
مجھے درست کرنا بند کرو,,مجھے درست کرنا بند کرو,5,1,مجھے | درست | کرنا | بند | کرو,مجھے درست کرنا بند کرو۔
آپ کو کتنی پلیٹیں چاہیے؟,,آپ کو کتنی پلیٹیں چاہیے؟,6,1,آپ | کو | کتنی | پلیٹیں | چاہیے | ؟,آپ کو کتنی پلیٹیں چاہیے؟
میں ہفتے میں ایک بار تیراکی کرتا ہوں۔,,میں ہفتے میں ایک بار تیراکی کرتا ہوں۔,9,1,میں | ہفتے | میں | ایک | بار | تیراکی | کرتا | ہوں | ۔,میں ہفتے میں ایک بار تیراکی کرتا ہوں۔
میرے دو کزن ہیں۔,,میرے دو کزن ہیں۔,5,1,میرے | دو | کزن | ہیں | ۔,میرے دو کزن ہیں۔
براہ کرم مجھے گلے لگائیں۔,,براہ کرم مجھے گلے لگائیں۔,6,1,براہ | کرم | مجھے | گلے | لگائیں | ۔,براہ کرم مجھے گلے لگائیں۔
یہ بہت دیر ہو سکتی ہے,,یہ بہت دیر ہو سکتی ہے,6,1,یہ | بہت | دیر | ہو | سکتی | ہے,یہ بہت دیر ہو سکتی ہے۔
میں گاڑی چلا سکتا ہوں۔,,میں گاڑی چلا سکتا ہوں۔,6,1,میں | گاڑی | چلا | سکتا | ہوں | ۔,میں گاڑی چلا سکتا ہوں۔
سب نے محسوس کیا,,سب نے محسوس کیا,4,1,سب | نے | محسوس | کیا,سب نے محسوس کیا۔
لڑکا رونے لگا,,لڑکا رونے لگا,3,1,لڑکا | رونے | لگا,لڑکا رونے لگا۔
برف باری دیکھو,,برف باری دیکھو,3,1,برف | باری | دیکھو,برف باری دیکھو۔
وہ ابھی تک نہیں آیا,,وہ ابھی تک نہیں آیا,5,1,وہ | ابھی | تک | نہیں | آیا,وہ ابھی تک نہیں آیا۔
ان تصاویر کو دیکھو,,ان تصاویر کو دیکھو,4,1,ان | تصاویر | کو | دیکھو,ان تصاویر کو دیکھو۔
زین سنجیدہ ہوا,,زین سنجیدہ ہوا,3,1,زین | سنجیدہ | ہوا,زین سنجیدہ ہوا۔
تمہیں آرام کرنا چاہیے,,تمہیں آرام کرنا چاہیے,4,1,تمہیں | آرام | کرنا | چاہیے,تمہیں آرام کرنا چاہیے۔
آپ اس کار کو استعمال کر سکتے ہیں۔,,آپ اس کار کو استعمال کر سکتے ہیں۔,9,1,آپ | اس | کار | کو | استعمال | کر | سکتے | ہیں | ۔,آپ اس کار کو استعمال کر سکتے ہیں۔
میرے خیال میں زین مہربان ہے۔,,میرے خیال میں زین مہربان ہے۔,7,1,میرے | خیال | میں | زین | مہربان | ہے | ۔,میرے خیال میں زین مہربان ہے۔
میں کشتی پر سو گیا۔,,میں کشتی پر سو گیا۔,6,1,میں | کشتی | پر | سو | گیا | ۔,میں کشتی پر سو گیا۔
میں گاڑی سے آؤں گا۔,,میں گاڑی سے آؤں گا۔,6,1,میں | گاڑی | سے | آؤں | گا | ۔,میں گاڑی سے آؤں گا۔
زین میرا پڑوسی ہے۔,,زین میرا پڑوسی ہے۔,5,1,زین | میرا | پڑوسی | ہے | ۔,زین میرا پڑوسی ہے۔
براہ کرم دوبارہ غور کریں۔,,براہ کرم دوبارہ غور کریں۔,6,1,براہ | کرم | دوبارہ | غور | کریں | ۔,براہ کرم دوبارہ غور کریں۔
تم جیو اور سیکھو,,تم جیو اور سیکھو,4,1,تم | جیو | اور | سیکھو,تم جیو اور سیکھو۔
میں چھپا رہا ہوں,,میں چھپا رہا ہوں,4,1,میں | چھپا | رہا | ہوں,میں چھپا رہا ہوں۔
سب کو سلام,,سب کو سلام,3,1,سب | کو | سلام,سب کو سلام۔
زین نے کہا,,زین نے کہا,3,1,زین | نے | کہا,زین نے کہا۔
میں خوش ھوں آپکو پسند آیا,,میں خوش ھوں آپکو پسند آیا,6,1,میں | خوش | ھوں | آپکو | پسند | آیا,میں خوش ھوں آپکو پسند آیا۔
یہ ٹام کے لیے ہے۔,,یہ ٹام کے لیے ہے۔,6,1,یہ | ٹام | کے | لیے | ہے | ۔,یہ ٹام کے لیے ہے۔
ایسا کیوں ہوا,,ایسا کیوں ہوا,3,1,ایسا | کیوں | ہوا,ایسا کیوں ہوا۔
وہ پرہیز کر رہا ہے,,وہ پرہیز کر رہا ہے,5,1,وہ | پرہیز | کر | رہا | ہے,وہ پرہیز کر رہا ہے۔
میں نے ابھی شاور لیا۔,,میں نے ابھی شاور لیا۔,6,1,میں | نے | ابھی | شاور | لیا | ۔,میں نے ابھی شاور لیا۔
میں سنجیدہ ہوں,,میں سنجیدہ ہوں,3,1,میں | سنجیدہ | ہوں,میں سنجیدہ ہوں۔
تھوڑا سا خود کو کنٹرول کرنے کی کوشش کریں,,تھوڑا سا خود کو کنٹرول کرنے کی کوشش کریں,9,1,تھوڑا | سا | خود | کو | کنٹرول | کرنے | کی | کوشش | کریں,تھوڑا سا خود کو کنٹرول کرنے کی کوشش کریں۔
میں موقع لوں گا۔,,میں موقع لوں گا۔,5,1,میں | موقع | لوں | گا | ۔,میں موقع لوں گا۔
مجھے آپ کے ساتھ رہنا پسند ہے۔,,مجھے آپ کے ساتھ رہنا پسند ہے۔,8,1,مجھے | آپ | کے | ساتھ | رہنا | پسند | ہے | ۔,مجھے آپ کے ساتھ رہنا پسند ہے۔
تم کہاں چھپے ہو,,تم کہاں چھپے ہو,4,1,تم | کہاں | چھپے | ہو,تم کہاں چھپے ہو۔
آؤ اور ہم سے ملو,,آؤ اور ہم سے ملو,5,1,آؤ | اور | ہم | سے | ملو,آؤ اور ہم سے ملو۔
شکریہ,,شکریہ,1,1,شکریہ,شکریہ۔
یہ بہت بڑا ہے,,یہ بہت بڑا ہے,4,1,یہ | بہت | بڑا | ہے,یہ بہت بڑا ہے۔
مسئلہ حل کرو,,مسئلہ حل کرو,3,1,مسئلہ | حل | کرو,مسئلہ حل کرو۔
تم یہاں کافی مصروف لگ رہے ہو۔,,تم یہاں کافی مصروف لگ رہے ہو۔,8,1,تم | یہاں | کافی | مصروف | لگ | رہے | ہو | ۔,تم یہاں کافی مصروف لگ رہے ہو۔
مجھے سمجھ ہے کہ,,مجھے سمجھ ہے کہ,4,1,مجھے | سمجھ | ہے | کہ,مجھے سمجھ ہے کہ۔
تم مغرور ہو,,تم مغرور ہو,3,1,تم | مغرور | ہو,تم مغرور ہو۔
مجھے گدگدی کرنا بند کرو,,مجھے گدگدی کرنا بند کرو,5,1,مجھے | گدگدی | کرنا | بند | کرو,مجھے گدگدی کرنا بند کرو۔
بکواس مت کرو,,بکواس مت کرو,3,1,بکواس | مت | کرو,بکواس مت کرو۔
یہ بہت مددگار ہے,,یہ بہت مددگار ہے,4,1,یہ | بہت | مددگار | ہے,یہ بہت مددگار ہے۔
ہم جلد ہی گھر پہنچ جائیں گے۔,,ہم جلد ہی گھر پہنچ جائیں گے۔,8,1,ہم | جلد | ہی | گھر | پہنچ | جائیں | گے | ۔,ہم جلد ہی گھر پہنچ جائیں گے۔
میں اسے ہر روز استعمال کرتا ہوں۔,,میں اسے ہر روز استعمال کرتا ہوں۔,8,1,میں | اسے | ہر | روز | استعمال | کرتا | ہوں | ۔,میں اسے ہر روز استعمال کرتا ہوں۔
اسے تلاش کرنا بہتر ہے۔,,اسے تلاش کرنا بہتر ہے۔,6,1,اسے | تلاش | کرنا | بہتر | ہے | ۔,اسے تلاش کرنا بہتر ہے۔
وہ رگبی کا کھلاڑی تھا۔,,وہ رگبی کا کھلاڑی تھا۔,6,1,وہ | رگبی | کا | کھلاڑی | تھا | ۔,وہ رگبی کا کھلاڑی تھا۔
ایک منظر نہ بنائیں,,ایک منظر نہ بنائیں,4,1,ایک | منظر | نہ | بنائیں,ایک منظر نہ بنائیں۔
اب اسے کال مت کرو,,اب اسے کال مت کرو,5,1,اب | اسے | کال | مت | کرو,اب اسے کال مت کرو۔
ستارے کیوں ٹمٹماتے ہیں,,ستارے کیوں ٹمٹماتے ہیں,4,1,ستارے | کیوں | ٹمٹماتے | ہیں,ستارے کیوں ٹمٹماتے ہیں۔
کیا آپ ہینڈ اسٹینڈ کر سکتے ہیں؟,,کیا آپ ہینڈ اسٹینڈ کر سکتے ہیں؟,8,1,کیا | آپ | ہینڈ | اسٹینڈ | کر | سکتے | ہیں | ؟,کیا آپ ہینڈ اسٹینڈ کر سکتے ہیں؟
میں صرف خوش قسمت ہوں,,میں صرف خوش قسمت ہوں,5,1,میں | صرف | خوش | قسمت | ہوں,میں صرف خوش قسمت ہوں۔
وہ خوش سے دور ہے,,وہ خوش سے دور ہے,5,1,وہ | خوش | سے | دور | ہے,وہ خوش سے دور ہے۔
مجھے لگتا ہے کہ آپ بیوقوف ہیں۔,,مجھے لگتا ہے کہ آپ بیوقوف ہیں۔,8,1,مجھے | لگتا | ہے | کہ | آپ | بیوقوف | ہیں | ۔,مجھے لگتا ہے کہ آپ بیوقوف ہیں۔
شہد خراب نہیں ہوتا,,شہد خراب نہیں ہوتا,4,1,شہد | خراب | نہیں | ہوتا,شہد خراب نہیں ہوتا۔
میں بھولنے والا نہیں ہوں۔,,میں بھولنے والا نہیں ہوں۔,6,1,میں | بھولنے | والا | نہیں | ہوں | ۔,میں بھولنے والا نہیں ہوں۔
ایک پولیس اہلکار مارا گیا,,ایک پولیس اہلکار مارا گیا,5,1,ایک | پولیس | اہلکار | مارا | گیا,ایک پولیس اہلکار مارا گیا۔
آپ اس میں اچھے ہیں,,آپ اس میں اچھے ہیں,5,1,آپ | اس | میں | اچھے | ہیں,آپ اس میں اچھے ہیں۔
میرے بال بہت گندے ہیں۔,,میرے بال بہت گندے ہیں۔,6,1,میرے | بال | بہت | گندے | ہیں | ۔,میرے بال بہت گندے ہیں۔
تھک گئے تھے,,تھک گئے تھے,3,1,تھک | گئے | تھے,تھک گئے تھے۔
وہ اب کیا کر رہا ہے,,وہ اب کیا کر رہا ہے,6,1,وہ | اب | کیا | کر | رہا | ہے,وہ اب کیا کر رہا ہے۔
میں نے اپنی چھتری کھو دی۔,,میں نے اپنی چھتری کھو دی۔,7,1,میں | نے | اپنی | چھتری | کھو | دی | ۔,میں نے اپنی چھتری کھو دی۔
مجھے کچھ جائفل چاہیے۔,,مجھے کچھ جائفل چاہیے۔,5,1,مجھے | کچھ | جائفل | چاہیے | ۔,مجھے کچھ جائفل چاہیے۔
یہ دوپہر کے کھانے کا وقت ہے,,یہ دوپہر کے کھانے کا وقت ہے,7,1,یہ | دوپہر | کے | کھانے | کا | وقت | ہے,یہ دوپہر کے کھانے کا وقت ہے۔
میں آپ کو ثابت کر سکتا ہوں۔,,میں آپ کو ثابت کر سکتا ہوں۔,8,1,میں | آپ | کو | ثابت | کر | سکتا | ہوں | ۔,میں آپ کو ثابت کر سکتا ہوں۔
ہم پہلے ہی مل چکے ہیں,,ہم پہلے ہی مل چکے ہیں,6,1,ہم | پہلے | ہی | مل | چکے | ہیں,ہم پہلے ہی مل چکے ہیں۔
مجھے فرانسیسی فلمیں پسند ہیں۔,,مجھے فرانسیسی فلمیں پسند ہیں۔,6,1,مجھے | فرانسیسی | فلمیں | پسند | ہیں | ۔,مجھے فرانسیسی فلمیں پسند ہیں۔
آپ کے پاس ایسا لومڑی دماغ ہے۔,,آپ کے پاس ایسا لومڑی دماغ ہے۔,8,1,آپ | کے | پاس | ایسا | لومڑی | دماغ | ہے | ۔,آپ کے پاس ایسا لومڑی دماغ ہے۔
میری بہن مشہور ہے۔,,میری بہن مشہور ہے۔,5,1,میری | بہن | مشہور | ہے | ۔,میری بہن مشہور ہے۔
ہمیں دیکھو,,ہمیں دیکھو,2,1,ہمیں | دیکھو,ہمیں دیکھو۔
میں نے آپ کو ووٹ دیا,,میں نے آپ کو ووٹ دیا,6,1,میں | نے | آپ | کو | ووٹ | دیا,میں نے آپ کو ووٹ دیا۔
زین غلط ہے,,زین غلط ہے,3,1,زین | غلط | ہے,زین غلط ہے۔
جس نے اسے بنایا,,جس نے اسے بنایا,4,1,جس | نے | اسے | بنایا,جس نے اسے بنایا۔
میں مشکل سے سانس لے سکتا ہوں۔,,میں مشکل سے سانس لے سکتا ہوں۔,8,1,میں | مشکل | سے | سانس | لے | سکتا | ہوں | ۔,میں مشکل سے سانس لے سکتا ہوں۔
آپ کا رابطہ نمبر کیا ہے؟,,آپ کا رابطہ نمبر کیا ہے؟,7,1,آپ | کا | رابطہ | نمبر | کیا | ہے | ؟,آپ کا رابطہ نمبر کیا ہے؟
آپ اس پر بھروسہ کر سکتے ہیں۔,,آپ اس پر بھروسہ کر سکتے ہیں۔,8,1,آپ | اس | پر | بھروسہ | کر | سکتے | ہیں | ۔,آپ اس پر بھروسہ کر سکتے ہیں۔
میں تمہیں گھر لے جاؤں گا۔,,میں تمہیں گھر لے جاؤں گا۔,7,1,میں | تمہیں | گھر | لے | جاؤں | گا | ۔,میں تمہیں گھر لے جاؤں گا۔
زین بزرگ,,زین بزرگ,2,1,زین | بزرگ,زین بزرگ۔
زین لمبے گھنٹے کام کرتا ہے۔,,زین لمبے گھنٹے کام کرتا ہے۔,7,1,زین | لمبے | گھنٹے | کام | کرتا | ہے | ۔,زین لمبے گھنٹے کام کرتا ہے۔
ہم واپس آنا چاہتے ہیں۔,,ہم واپس آنا چاہتے ہیں۔,6,1,ہم | واپس | آنا | چاہتے | ہیں | ۔,ہم واپس آنا چاہتے ہیں۔
یہ آپ کا منصوبہ تھا؟,,یہ آپ کا منصوبہ تھا؟,6,1,یہ | آپ | کا | منصوبہ | تھا | ؟,یہ آپ کا منصوبہ تھا؟
ہم نے سب کچھ دیکھا,,ہم نے سب کچھ دیکھا,5,1,ہم | نے | سب | کچھ | دیکھا,ہم نے سب کچھ دیکھا۔
انہوں نے ٹام کو ہتھکڑیاں لگائیں۔,,انہوں نے ٹام کو ہتھکڑیاں لگائیں۔,7,1,انہوں | نے | ٹام | کو | ہتھکڑیاں | لگائیں | ۔,انہوں نے ٹام کو ہتھکڑیاں لگائیں۔
میں ان پر الزام نہیں لگاؤں گا۔,,میں ان پر الزام نہیں لگاؤں گا۔,8,1,میں | ان | پر | الزام | نہیں | لگاؤں | گا | ۔,میں ان پر الزام نہیں لگاؤں گا۔
ہم صرف انتظار کر سکتے ہیں,,ہم صرف انتظار کر سکتے ہیں,6,1,ہم | صرف | انتظار | کر | سکتے | ہیں,ہم صرف انتظار کر سکتے ہیں۔
سی آئی اے کے ساتھ تھے۔,,سی آئی اے کے ساتھ تھے۔,7,1,سی | آئی | اے | کے | ساتھ | تھے | ۔,سی آئی اے کے ساتھ تھے۔
میں بھوکا نہیں ہوں۔,,میں بھوکا نہیں ہوں۔,5,1,میں | بھوکا | نہیں | ہوں | ۔,میں بھوکا نہیں ہوں۔
زین نے کچھ پوچھا,,زین نے کچھ پوچھا,4,1,زین | نے | کچھ | پوچھا,زین نے کچھ پوچھا۔
زین ٹھیک ہے؟,,زین ٹھیک ہے؟,4,1,زین | ٹھیک | ہے | ؟,زین ٹھیک ہے؟
میں نے بلی کو اندر جانے دیا۔,,میں نے بلی کو اندر جانے دیا۔,8,1,میں | نے | بلی | کو | اندر | جانے | دیا | ۔,میں نے بلی کو اندر جانے دیا۔
مجھے کتاب آسان لگی,,مجھے کتاب آسان لگی,4,1,مجھے | کتاب | آسان | لگی,مجھے کتاب آسان لگی۔
اس نے اسے معاف کر دیا,,اس نے اسے معاف کر دیا,6,1,اس | نے | اسے | معاف | کر | دیا,اس نے اسے معاف کر دیا۔
زین گالف کھیل رہا ہے۔,,زین گالف کھیل رہا ہے۔,6,1,زین | گالف | کھیل | رہا | ہے | ۔,زین گالف کھیل رہا ہے۔
یہ عام نہیں ہے,,یہ عام نہیں ہے,4,1,یہ | عام | نہیں | ہے,یہ عام نہیں ہے۔
یہ ایک عظیم کہانی ہے,,یہ ایک عظیم کہانی ہے,5,1,یہ | ایک | عظیم | کہانی | ہے,یہ ایک عظیم کہانی ہے۔
زین نے ہم سے جھوٹ بولا,,زین نے ہم سے جھوٹ بولا,6,1,زین | نے | ہم | سے | جھوٹ | بولا,زین نے ہم سے جھوٹ بولا۔
یہاں شور مت کرو,,یہاں شور مت کرو,4,1,یہاں | شور | مت | کرو,یہاں شور مت کرو۔
افادیت اضافی ہیں,,افادیت اضافی ہیں,3,1,افادیت | اضافی | ہیں,افادیت اضافی ہیں۔
زین چلا گیا,,زین چلا گیا,3,1,زین | چلا | گیا,زین چلا گیا۔
مجھے یہ پسند نہیں ہے۔,,مجھے یہ پسند نہیں ہے۔,6,1,مجھے | یہ | پسند | نہیں | ہے | ۔,مجھے یہ پسند نہیں ہے۔
زین نے پیسے چرا لیے,,زین نے پیسے چرا لیے,5,1,زین | نے | پیسے | چرا | لیے,زین نے پیسے چرا لیے۔
دو باقی تھے,,دو باقی تھے,3,1,دو | باقی | تھے,دو باقی تھے۔
میں ریڈیو پر خبریں سن رہا تھا۔,,میں ریڈیو پر خبریں سن رہا تھا۔,8,1,میں | ریڈیو | پر | خبریں | سن | رہا | تھا | ۔,میں ریڈیو پر خبریں سن رہا تھا۔
ہمیں پتنگیں اڑانا پسند نہیں ہے۔,,ہمیں پتنگیں اڑانا پسند نہیں ہے۔,7,1,ہمیں | پتنگیں | اڑانا | پسند | نہیں | ہے | ۔,ہمیں پتنگیں اڑانا پسند نہیں ہے۔
اس نے سخت مطالعہ کیا,,اس نے سخت مطالعہ کیا,5,1,اس | نے | سخت | مطالعہ | کیا,اس نے سخت مطالعہ کیا۔
میرے کندھوں میں درد ہے,,میرے کندھوں میں درد ہے,5,1,میرے | کندھوں | میں | درد | ہے,میرے کندھوں میں درد ہے۔
مدد کرنے کا شکریہ,,مدد کرنے کا شکریہ,4,1,مدد | کرنے | کا | شکریہ,مدد کرنے کا شکریہ۔
کیا وہ ہمیں دیکھ سکتا ہے؟,,کیا وہ ہمیں دیکھ سکتا ہے؟,7,1,کیا | وہ | ہمیں | دیکھ | سکتا | ہے | ؟,کیا وہ ہمیں دیکھ سکتا ہے؟
یہ جمنے والی سردی ہے,,یہ جمنے والی سردی ہے,5,1,یہ | جمنے | والی | سردی | ہے,یہ جمنے والی سردی ہے۔
یہ ایک احمقانہ شرط تھی,,یہ ایک احمقانہ شرط تھی,5,1,یہ | ایک | احمقانہ | شرط | تھی,یہ ایک احمقانہ شرط تھی۔
میں کروشیا سے ہوں,,میں کروشیا سے ہوں,4,1,میں | کروشیا | سے | ہوں,میں کروشیا سے ہوں۔
آج رات کیسا ہے؟,,آج رات کیسا ہے؟,5,1,آج | رات | کیسا | ہے | ؟,آج رات کیسا ہے؟
جاؤ بیئر پیو,,جاؤ بیئر پیو,3,1,جاؤ | بیئر | پیو,جاؤ بیئر پیو۔
انہوں نے گانا چھوڑ دیا,,انہوں نے گانا چھوڑ دیا,5,1,انہوں | نے | گانا | چھوڑ | دیا,انہوں نے گانا چھوڑ دیا۔
مجھے زین کی ڈائری ملی,,مجھے زین کی ڈائری ملی,5,1,مجھے | زین | کی | ڈائری | ملی,مجھے زین کی ڈائری ملی۔
دروازہ بند کرو,,دروازہ بند کرو,3,1,دروازہ | بند | کرو,دروازہ بند کرو۔
اس کے ہاتھ خالی تھے,,اس کے ہاتھ خالی تھے,5,1,اس | کے | ہاتھ | خالی | تھے,اس کے ہاتھ خالی تھے۔
مجھے لگتا ہے کہ میں سمجھتا ہوں,,مجھے لگتا ہے کہ میں سمجھتا ہوں,7,1,مجھے | لگتا | ہے | کہ | میں | سمجھتا | ہوں,مجھے لگتا ہے کہ میں سمجھتا ہوں۔
میری بلی کو دودھ پسند ہے۔,,میری بلی کو دودھ پسند ہے۔,7,1,میری | بلی | کو | دودھ | پسند | ہے | ۔,میری بلی کو دودھ پسند ہے۔
مجھے ٹام کو فون کرنا ہے۔,,مجھے ٹام کو فون کرنا ہے۔,7,1,مجھے | ٹام | کو | فون | کرنا | ہے | ۔,مجھے ٹام کو فون کرنا ہے۔
یہ ایک کھیل نہیں ہے,,یہ ایک کھیل نہیں ہے,5,1,یہ | ایک | کھیل | نہیں | ہے,یہ ایک کھیل نہیں ہے۔
اس نے مجھے آہستہ سے دھکا دیا,,اس نے مجھے آہستہ سے دھکا دیا,7,1,اس | نے | مجھے | آہستہ | سے | دھکا | دیا,اس نے مجھے آہستہ سے دھکا دیا۔
بچے جاگ رہے ہیں,,بچے جاگ رہے ہیں,4,1,بچے | جاگ | رہے | ہیں,بچے جاگ رہے ہیں۔
ان کے پاس تصویر ہے,,ان کے پاس تصویر ہے,5,1,ان | کے | پاس | تصویر | ہے,ان کے پاس تصویر ہے۔
وہ بہت تھکا ہوا لگ رہا ہے,,وہ بہت تھکا ہوا لگ رہا ہے,7,1,وہ | بہت | تھکا | ہوا | لگ | رہا | ہے,وہ بہت تھکا ہوا لگ رہا ہے۔
یہ کیسا لگ رہا ہے,,یہ کیسا لگ رہا ہے,5,1,یہ | کیسا | لگ | رہا | ہے,یہ کیسا لگ رہا ہے۔
میں یہ اکیلا نہیں کر سکتا,,میں یہ اکیلا نہیں کر سکتا,6,1,میں | یہ | اکیلا | نہیں | کر | سکتا,میں یہ اکیلا نہیں کر سکتا۔
وہ ایک بس بوائے کے طور پر کام کرتا ہے۔,,وہ ایک بس بوائے کے طور پر کام کرتا ہے۔,11,1,وہ | ایک | بس | بوائے | کے | طور | پر | کام | کرتا | ہے | ۔,وہ ایک بس بوائے کے طور پر کام کرتا ہے۔
میں یہ ہر وقت کہتا ہوں۔,,میں یہ ہر وقت کہتا ہوں۔,7,1,میں | یہ | ہر | وقت | کہتا | ہوں | ۔,میں یہ ہر وقت کہتا ہوں۔
میں مچھلی پیس رہا ہوں۔,,میں مچھلی پیس رہا ہوں۔,6,1,میں | مچھلی | پیس | رہا | ہوں | ۔,میں مچھلی پیس رہا ہوں۔
مدد اس کے راستے پر ہے,,مدد اس کے راستے پر ہے,6,1,مدد | اس | کے | راستے | پر | ہے,مدد اس کے راستے پر ہے۔
میں اب نروس ہوں,,میں اب نروس ہوں,4,1,میں | اب | نروس | ہوں,میں اب نروس ہوں۔
کسی نے جواب دیا,,کسی نے جواب دیا,4,1,کسی | نے | جواب | دیا,کسی نے جواب دیا۔
زین منا رہا ہے,,زین منا رہا ہے,4,1,زین | منا | رہا | ہے,زین منا رہا ہے۔
میں اضافہ چاہتا ہوں۔,,میں اضافہ چاہتا ہوں۔,5,1,میں | اضافہ | چاہتا | ہوں | ۔,میں اضافہ چاہتا ہوں۔
وہ گپ شپ سے محبت کرتا ہے,,وہ گپ شپ سے محبت کرتا ہے,7,1,وہ | گپ | شپ | سے | محبت | کرتا | ہے,وہ گپ شپ سے محبت کرتا ہے۔
وہ بھوکا لگتا ہے,,وہ بھوکا لگتا ہے,4,1,وہ | بھوکا | لگتا | ہے,وہ بھوکا لگتا ہے۔
وہ قسم کھانے لگا,,وہ قسم کھانے لگا,4,1,وہ | قسم | کھانے | لگا,وہ قسم کھانے لگا۔
میں نہیں جانا چاہتا,,میں نہیں جانا چاہتا,4,1,میں | نہیں | جانا | چاہتا,میں نہیں جانا چاہتا۔
کیا میں پوچھ سکتا ہوں کیوں نہیں؟,,کیا میں پوچھ سکتا ہوں کیوں نہیں؟,8,1,کیا | میں | پوچھ | سکتا | ہوں | کیوں | نہیں | ؟,کیا میں پوچھ سکتا ہوں کیوں نہیں؟
وہ ایک سست ہے,,وہ ایک سست ہے,4,1,وہ | ایک | سست | ہے,وہ ایک سست ہے۔
کیا گڑبڑ,,کیا گڑبڑ,2,1,کیا | گڑبڑ,کیا گڑبڑ۔
وہ اداس لگ رہا تھا,,وہ اداس لگ رہا تھا,5,1,وہ | اداس | لگ | رہا | تھا,وہ اداس لگ رہا تھا۔
وہ لڑنا جانتا ہے۔,,وہ لڑنا جانتا ہے۔,5,1,وہ | لڑنا | جانتا | ہے | ۔,وہ لڑنا جانتا ہے۔
میں ناکام ہو گیا ہوں,,میں ناکام ہو گیا ہوں,5,1,میں | ناکام | ہو | گیا | ہوں,میں ناکام ہو گیا ہوں۔
یہ سمجھ میں آتا ہے,,یہ سمجھ میں آتا ہے,5,1,یہ | سمجھ | میں | آتا | ہے,یہ سمجھ میں آتا ہے۔
میں نے ایک نیا سوٹ خریدا۔,,میں نے ایک نیا سوٹ خریدا۔,7,1,میں | نے | ایک | نیا | سوٹ | خریدا | ۔,میں نے ایک نیا سوٹ خریدا۔
اس کے پاس دس گائیں ہیں۔,,اس کے پاس دس گائیں ہیں۔,7,1,اس | کے | پاس | دس | گائیں | ہیں | ۔,اس کے پاس دس گائیں ہیں۔
وہ گانے میں اچھا ہے,,وہ گانے میں اچھا ہے,5,1,وہ | گانے | میں | اچھا | ہے,وہ گانے میں اچھا ہے۔
مجھے رینگنے والے جانوروں سے نفرت ہے۔,,مجھے رینگنے والے جانوروں سے نفرت ہے۔,8,1,مجھے | رینگنے | والے | جانوروں | سے | نفرت | ہے | ۔,مجھے رینگنے والے جانوروں سے نفرت ہے۔
وہ وہاں نہیں ہے,,وہ وہاں نہیں ہے,4,1,وہ | وہاں | نہیں | ہے,وہ وہاں نہیں ہے۔
