text,label,clean,token_count,sentence_count,tokens,sentences
زین کو یاد ہے,,زین کو یاد ہے,4,1,زین | کو | یاد | ہے,زین کو یاد ہے۔
وہ اکیلا رہتا ہے,,وہ اکیلا رہتا ہے,4,1,وہ | اکیلا | رہتا | ہے,وہ اکیلا رہتا ہے۔
الارم بج گیا,,الارم بج گیا,3,1,الارم | بج | گیا,الارم بج گیا۔
میں بمشکل ٹام کو جانتا تھا۔,,میں بمشکل ٹام کو جانتا تھا۔,7,1,میں | بمشکل | ٹام | کو | جانتا | تھا | ۔,میں بمشکل ٹام کو جانتا تھا۔
کبھی مت بھولنا,,کبھی مت بھولنا,3,1,کبھی | مت | بھولنا,کبھی مت بھولنا۔
وہ کیمپس سے دور رہتا ہے۔,,وہ کیمپس سے دور رہتا ہے۔,7,1,وہ | کیمپس | سے | دور | رہتا | ہے | ۔,وہ کیمپس سے دور رہتا ہے۔
مجھے بیٹھنا ہے,,مجھے بیٹھنا ہے,3,1,مجھے | بیٹھنا | ہے,مجھے بیٹھنا ہے۔
بلیاں ہوشیار ہیں,,بلیاں ہوشیار ہیں,3,1,بلیاں | ہوشیار | ہیں,بلیاں ہوشیار ہیں۔
انہوں نے سیاست کی,,انہوں نے سیاست کی,4,1,انہوں | نے | سیاست | کی,انہوں نے سیاست کی۔
وہ صرف برا ہے,,وہ صرف برا ہے,4,1,وہ | صرف | برا | ہے,وہ صرف برا ہے۔
کیا یہ آپ کے گھوڑے ہیں؟,,کیا یہ آپ کے گھوڑے ہیں؟,7,1,کیا | یہ | آپ | کے | گھوڑے | ہیں | ؟,کیا یہ آپ کے گھوڑے ہیں؟
زین ڈوب رہا ہے,,زین ڈوب رہا ہے,4,1,زین | ڈوب | رہا | ہے,زین ڈوب رہا ہے۔
زین نے بلایا,,زین نے بلایا,3,1,زین | نے | بلایا,زین نے بلایا۔
میں نے کہا لے لو,,میں نے کہا لے لو,5,1,میں | نے | کہا | لے | لو,میں نے کہا لے لو۔
اس نے اپنا کام کھو دیا,,اس نے اپنا کام کھو دیا,6,1,اس | نے | اپنا | کام | کھو | دیا,اس نے اپنا کام کھو دیا۔
وہ غلط ہیں,,وہ غلط ہیں,3,1,وہ | غلط | ہیں,وہ غلط ہیں۔
اس نے اپنی نئی گھڑی کھو دی۔,,اس نے اپنی نئی گھڑی کھو دی۔,8,1,اس | نے | اپنی | نئی | گھڑی | کھو | دی | ۔,اس نے اپنی نئی گھڑی کھو دی۔
میں تمہیں یاد کروں گا ٹام,,میں تمہیں یاد کروں گا ٹام,6,1,میں | تمہیں | یاد | کروں | گا | ٹام,میں تمہیں یاد کروں گا ٹام۔
زین گاڑی چلا سکتا ہے۔,,زین گاڑی چلا سکتا ہے۔,6,1,زین | گاڑی | چلا | سکتا | ہے | ۔,زین گاڑی چلا سکتا ہے۔
ہم سنتری کا رس بیچتے ہیں۔,,ہم سنتری کا رس بیچتے ہیں۔,7,1,ہم | سنتری | کا | رس | بیچتے | ہیں | ۔,ہم سنتری کا رس بیچتے ہیں۔
وہ یہاں نہیں ہے,,وہ یہاں نہیں ہے,4,1,وہ | یہاں | نہیں | ہے,وہ یہاں نہیں ہے۔
آپ آئیں گے یا نہیں؟,,آپ آئیں گے یا نہیں؟,6,1,آپ | آئیں | گے | یا | نہیں | ؟,آپ آئیں گے یا نہیں؟
کیا آپ نیچے آ رہے ہیں؟,,کیا آپ نیچے آ رہے ہیں؟,7,1,کیا | آپ | نیچے | آ | رہے | ہیں | ؟,کیا آپ نیچے آ رہے ہیں؟
زین ایک طالب علم ہے۔,,زین ایک طالب علم ہے۔,6,1,زین | ایک | طالب | علم | ہے | ۔,زین ایک طالب علم ہے۔
یہ میری غلطی تھی,,یہ میری غلطی تھی,4,1,یہ | میری | غلطی | تھی,یہ میری غلطی تھی۔
میں نے مجرم محسوس کیا,,میں نے مجرم محسوس کیا,5,1,میں | نے | مجرم | محسوس | کیا,میں نے مجرم محسوس کیا۔
زین نے وقت پر بنایا,,زین نے وقت پر بنایا,5,1,زین | نے | وقت | پر | بنایا,زین نے وقت پر بنایا۔
جس نے یہ حکم دیا,,جس نے یہ حکم دیا,5,1,جس | نے | یہ | حکم | دیا,جس نے یہ حکم دیا۔
میں نے ایک دو کال کی۔,,میں نے ایک دو کال کی۔,7,1,میں | نے | ایک | دو | کال | کی | ۔,میں نے ایک دو کال کی۔
میں صرف صحت چاہتا ہوں۔,,میں صرف صحت چاہتا ہوں۔,6,1,میں | صرف | صحت | چاہتا | ہوں | ۔,میں صرف صحت چاہتا ہوں۔
اب ہم آپ کو جان لیں گے۔,,اب ہم آپ کو جان لیں گے۔,8,1,اب | ہم | آپ | کو | جان | لیں | گے | ۔,اب ہم آپ کو جان لیں گے۔
براہ کرم کتے کو کھانا کھلائیں۔,,براہ کرم کتے کو کھانا کھلائیں۔,7,1,براہ | کرم | کتے | کو | کھانا | کھلائیں | ۔,براہ کرم کتے کو کھانا کھلائیں۔
میں خود کر سکتا ہوں۔,,میں خود کر سکتا ہوں۔,6,1,میں | خود | کر | سکتا | ہوں | ۔,میں خود کر سکتا ہوں۔
زین کو اس بات کا علم تھا۔,,زین کو اس بات کا علم تھا۔,8,1,زین | کو | اس | بات | کا | علم | تھا | ۔,زین کو اس بات کا علم تھا۔
کیا آپ کا کتا مطلب ہے؟,,کیا آپ کا کتا مطلب ہے؟,7,1,کیا | آپ | کا | کتا | مطلب | ہے | ؟,کیا آپ کا کتا مطلب ہے؟
اس پر چڑھو,,اس پر چڑھو,3,1,اس | پر | چڑھو,اس پر چڑھو۔
اپنا شاٹ لے لو,,اپنا شاٹ لے لو,4,1,اپنا | شاٹ | لے | لو,اپنا شاٹ لے لو۔
میں نے یہ کتاب لکھی۔,,میں نے یہ کتاب لکھی۔,6,1,میں | نے | یہ | کتاب | لکھی | ۔,میں نے یہ کتاب لکھی۔
اپنی جان کے لیے بھاگو,,اپنی جان کے لیے بھاگو,5,1,اپنی | جان | کے | لیے | بھاگو,اپنی جان کے لیے بھاگو۔
مجھے سیب سب سے زیادہ پسند ہے۔,,مجھے سیب سب سے زیادہ پسند ہے۔,8,1,مجھے | سیب | سب | سے | زیادہ | پسند | ہے | ۔,مجھے سیب سب سے زیادہ پسند ہے۔
باہر سردی تھی,,باہر سردی تھی,3,1,باہر | سردی | تھی,باہر سردی تھی۔
اس نے مجھ سے اتفاق کیا,,اس نے مجھ سے اتفاق کیا,6,1,اس | نے | مجھ | سے | اتفاق | کیا,اس نے مجھ سے اتفاق کیا۔
میں تھک گیا ہوں,,میں تھک گیا ہوں,4,1,میں | تھک | گیا | ہوں,میں تھک گیا ہوں۔
بات کو چھوڑ دو,,بات کو چھوڑ دو,4,1,بات | کو | چھوڑ | دو,بات کو چھوڑ دو۔
یہ نہیں کیا جا سکتا,,یہ نہیں کیا جا سکتا,5,1,یہ | نہیں | کیا | جا | سکتا,یہ نہیں کیا جا سکتا۔
ہم آپ کو بتائیں گے,,ہم آپ کو بتائیں گے,5,1,ہم | آپ | کو | بتائیں | گے,ہم آپ کو بتائیں گے۔
اگر آپ چاہیں تو میں رہوں گا۔,,اگر آپ چاہیں تو میں رہوں گا۔,8,1,اگر | آپ | چاہیں | تو | میں | رہوں | گا | ۔,اگر آپ چاہیں تو میں رہوں گا۔
تم بیمار ہو,,تم بیمار ہو,3,1,تم | بیمار | ہو,تم بیمار ہو۔
میری گھڑی درست ہے۔,,میری گھڑی درست ہے۔,5,1,میری | گھڑی | درست | ہے | ۔,میری گھڑی درست ہے۔
دوسروں کی طرف اشارہ کرنا شائستہ نہیں ہے۔,,دوسروں کی طرف اشارہ کرنا شائستہ نہیں ہے۔,9,1,دوسروں | کی | طرف | اشارہ | کرنا | شائستہ | نہیں | ہے | ۔,دوسروں کی طرف اشارہ کرنا شائستہ نہیں ہے۔
اسے موسیقی بہت پسند ہے۔,,اسے موسیقی بہت پسند ہے۔,6,1,اسے | موسیقی | بہت | پسند | ہے | ۔,اسے موسیقی بہت پسند ہے۔
زین عجیب سا لگتا ہے۔,,زین عجیب سا لگتا ہے۔,6,1,زین | عجیب | سا | لگتا | ہے | ۔,زین عجیب سا لگتا ہے۔
وہ میری ہم جماعت ہے۔,,وہ میری ہم جماعت ہے۔,6,1,وہ | میری | ہم | جماعت | ہے | ۔,وہ میری ہم جماعت ہے۔
وہ کام پر چلا گیا,,وہ کام پر چلا گیا,5,1,وہ | کام | پر | چلا | گیا,وہ کام پر چلا گیا۔
مجھے پریشان کرنا چھوڑ دو,,مجھے پریشان کرنا چھوڑ دو,5,1,مجھے | پریشان | کرنا | چھوڑ | دو,مجھے پریشان کرنا چھوڑ دو۔
ڈسکو خالی ہے,,ڈسکو خالی ہے,3,1,ڈسکو | خالی | ہے,ڈسکو خالی ہے۔
مجھے نیند ارہی ہے,,مجھے نیند ارہی ہے,4,1,مجھے | نیند | ارہی | ہے,مجھے نیند ارہی ہے۔
زین رونے لگا,,زین رونے لگا,3,1,زین | رونے | لگا,زین رونے لگا۔
شہر میں ہیضہ پھیل گیا۔,,شہر میں ہیضہ پھیل گیا۔,6,1,شہر | میں | ہیضہ | پھیل | گیا | ۔,شہر میں ہیضہ پھیل گیا۔
یہ حقیقی نہیں ہے,,یہ حقیقی نہیں ہے,4,1,یہ | حقیقی | نہیں | ہے,یہ حقیقی نہیں ہے۔
مجھے اتنا یقین نہیں ہوگا۔,,مجھے اتنا یقین نہیں ہوگا۔,6,1,مجھے | اتنا | یقین | نہیں | ہوگا | ۔,مجھے اتنا یقین نہیں ہوگا۔
میں نے بالکل مطالعہ نہیں کیا۔,,میں نے بالکل مطالعہ نہیں کیا۔,7,1,میں | نے | بالکل | مطالعہ | نہیں | کیا | ۔,میں نے بالکل مطالعہ نہیں کیا۔
میری بیوی چینی ہے,,میری بیوی چینی ہے,4,1,میری | بیوی | چینی | ہے,میری بیوی چینی ہے۔
مجھے فرانسیسی فلمیں پسند ہیں۔,,مجھے فرانسیسی فلمیں پسند ہیں۔,6,1,مجھے | فرانسیسی | فلمیں | پسند | ہیں | ۔,مجھے فرانسیسی فلمیں پسند ہیں۔
جیسا کہ وہ تمہیں کہتا ہے کرو,,جیسا کہ وہ تمہیں کہتا ہے کرو,7,1,جیسا | کہ | وہ | تمہیں | کہتا | ہے | کرو,جیسا کہ وہ تمہیں کہتا ہے کرو۔
مجھے بڑے کتے پسند نہیں ہیں۔,,مجھے بڑے کتے پسند نہیں ہیں۔,7,1,مجھے | بڑے | کتے | پسند | نہیں | ہیں | ۔,مجھے بڑے کتے پسند نہیں ہیں۔
بس یہی,,بس یہی,2,1,بس | یہی,بس یہی۔
اسے اس پر رحم آیا,,اسے اس پر رحم آیا,5,1,اسے | اس | پر | رحم | آیا,اسے اس پر رحم آیا۔
زین نے زہر کھا لیا۔,,زین نے زہر کھا لیا۔,6,1,زین | نے | زہر | کھا | لیا | ۔,زین نے زہر کھا لیا۔
ڈاکٹر کو فون کرو,,ڈاکٹر کو فون کرو,4,1,ڈاکٹر | کو | فون | کرو,ڈاکٹر کو فون کرو۔
اس کی انسانی فطرت,,اس کی انسانی فطرت,4,1,اس | کی | انسانی | فطرت,اس کی انسانی فطرت۔
کیا اپ ابھی فارغ ہیں,,کیا اپ ابھی فارغ ہیں,5,1,کیا | اپ | ابھی | فارغ | ہیں,کیا اپ ابھی فارغ ہیں۔
ان کتابوں کی ہمیشہ بہت مانگ رہتی ہے۔,,ان کتابوں کی ہمیشہ بہت مانگ رہتی ہے۔,9,1,ان | کتابوں | کی | ہمیشہ | بہت | مانگ | رہتی | ہے | ۔,ان کتابوں کی ہمیشہ بہت مانگ رہتی ہے۔
جس نے کتاب لکھی۔,,جس نے کتاب لکھی۔,5,1,جس | نے | کتاب | لکھی | ۔,جس نے کتاب لکھی۔
وہ کافی جوان دکھ رہی ہے۔,,وہ کافی جوان دکھ رہی ہے۔,7,1,وہ | کافی | جوان | دکھ | رہی | ہے | ۔,وہ کافی جوان دکھ رہی ہے۔
میں لڑکے کو دیکھتا ہوں۔,,میں لڑکے کو دیکھتا ہوں۔,6,1,میں | لڑکے | کو | دیکھتا | ہوں | ۔,میں لڑکے کو دیکھتا ہوں۔
زین اسے خریدنا چاہتا تھا۔,,زین اسے خریدنا چاہتا تھا۔,6,1,زین | اسے | خریدنا | چاہتا | تھا | ۔,زین اسے خریدنا چاہتا تھا۔
ہم ناکام نہیں ہوں گے,,ہم ناکام نہیں ہوں گے,5,1,ہم | ناکام | نہیں | ہوں | گے,ہم ناکام نہیں ہوں گے۔
اس کا لہجہ اچھا ہے۔,,اس کا لہجہ اچھا ہے۔,6,1,اس | کا | لہجہ | اچھا | ہے | ۔,اس کا لہجہ اچھا ہے۔
مجھے چاول کا شوق نہیں ہے۔,,مجھے چاول کا شوق نہیں ہے۔,7,1,مجھے | چاول | کا | شوق | نہیں | ہے | ۔,مجھے چاول کا شوق نہیں ہے۔
مجھے وہ شو پسند تھا۔,,مجھے وہ شو پسند تھا۔,6,1,مجھے | وہ | شو | پسند | تھا | ۔,مجھے وہ شو پسند تھا۔
وہ زیادہ پر اعتماد ہے,,وہ زیادہ پر اعتماد ہے,5,1,وہ | زیادہ | پر | اعتماد | ہے,وہ زیادہ پر اعتماد ہے۔
تم جانتے ہو کہ میں شادی شدہ ہوں۔,,تم جانتے ہو کہ میں شادی شدہ ہوں۔,9,1,تم | جانتے | ہو | کہ | میں | شادی | شدہ | ہوں | ۔,تم جانتے ہو کہ میں شادی شدہ ہوں۔
میں آپ کے منہ پر تھپڑ ماروں گا۔,,میں آپ کے منہ پر تھپڑ ماروں گا۔,9,1,میں | آپ | کے | منہ | پر | تھپڑ | ماروں | گا | ۔,میں آپ کے منہ پر تھپڑ ماروں گا۔
مجھے ایک ڈاک ٹکٹ چاہیے,,مجھے ایک ڈاک ٹکٹ چاہیے,5,1,مجھے | ایک | ڈاک | ٹکٹ | چاہیے,مجھے ایک ڈاک ٹکٹ چاہیے۔
زین نے میرا دل توڑ دیا۔,,زین نے میرا دل توڑ دیا۔,7,1,زین | نے | میرا | دل | توڑ | دیا | ۔,زین نے میرا دل توڑ دیا۔
مجھے اچھا محسوس ہورہا ہے,,مجھے اچھا محسوس ہورہا ہے,5,1,مجھے | اچھا | محسوس | ہورہا | ہے,مجھے اچھا محسوس ہورہا ہے۔
ابھی,,ابھی,1,1,ابھی,ابھی۔
ہم نے ایک بچہ گود لیا,,ہم نے ایک بچہ گود لیا,6,1,ہم | نے | ایک | بچہ | گود | لیا,ہم نے ایک بچہ گود لیا۔
براہ مہربانی اسے روکیں,,براہ مہربانی اسے روکیں,4,1,براہ | مہربانی | اسے | روکیں,براہ مہربانی اسے روکیں۔
ہمارے پاس چائے نہیں ہے,,ہمارے پاس چائے نہیں ہے,5,1,ہمارے | پاس | چائے | نہیں | ہے,ہمارے پاس چائے نہیں ہے۔
پارٹیاں ختم,,پارٹیاں ختم,2,1,پارٹیاں | ختم,پارٹیاں ختم۔
میرے لیے ایک خشک تولیہ لاؤ,,میرے لیے ایک خشک تولیہ لاؤ,6,1,میرے | لیے | ایک | خشک | تولیہ | لاؤ,میرے لیے ایک خشک تولیہ لاؤ۔
میں پرانے زمانے کا ہوں,,میں پرانے زمانے کا ہوں,5,1,میں | پرانے | زمانے | کا | ہوں,میں پرانے زمانے کا ہوں۔
مجھے ڈاک ٹکٹ خریدنے کی ضرورت ہے۔,,مجھے ڈاک ٹکٹ خریدنے کی ضرورت ہے۔,8,1,مجھے | ڈاک | ٹکٹ | خریدنے | کی | ضرورت | ہے | ۔,مجھے ڈاک ٹکٹ خریدنے کی ضرورت ہے۔
لوگ عجیب ہیں,,لوگ عجیب ہیں,3,1,لوگ | عجیب | ہیں,لوگ عجیب ہیں۔
تبدیلی اہم ہے,,تبدیلی اہم ہے,3,1,تبدیلی | اہم | ہے,تبدیلی اہم ہے۔
ابھی دیر نہیں ہوئی,,ابھی دیر نہیں ہوئی,4,1,ابھی | دیر | نہیں | ہوئی,ابھی دیر نہیں ہوئی۔
میں اسے تمہارے لیے لے آؤں گا۔,,میں اسے تمہارے لیے لے آؤں گا۔,8,1,میں | اسے | تمہارے | لیے | لے | آؤں | گا | ۔,میں اسے تمہارے لیے لے آؤں گا۔
تم فضول ہو,,تم فضول ہو,3,1,تم | فضول | ہو,تم فضول ہو۔
اسے بات کرنے دو,,اسے بات کرنے دو,4,1,اسے | بات | کرنے | دو,اسے بات کرنے دو۔
وہ شکار کرنا پسند کرتا ہے۔,,وہ شکار کرنا پسند کرتا ہے۔,7,1,وہ | شکار | کرنا | پسند | کرتا | ہے | ۔,وہ شکار کرنا پسند کرتا ہے۔
میں ناراض ہوں,,میں ناراض ہوں,3,1,میں | ناراض | ہوں,میں ناراض ہوں۔
زین پاگل تھا,,زین پاگل تھا,3,1,زین | پاگل | تھا,زین پاگل تھا۔
اس نے میرے ساتھ زیادتی کی۔,,اس نے میرے ساتھ زیادتی کی۔,7,1,اس | نے | میرے | ساتھ | زیادتی | کی | ۔,اس نے میرے ساتھ زیادتی کی۔
زین نے کسی کو بتایا؟,,زین نے کسی کو بتایا؟,6,1,زین | نے | کسی | کو | بتایا | ؟,زین نے کسی کو بتایا؟
روزانہ ورزش آپ کو فٹ اور صحت مند بناتی ہے۔,,روزانہ ورزش آپ کو فٹ اور صحت مند بناتی ہے۔,11,1,روزانہ | ورزش | آپ | کو | فٹ | اور | صحت | مند | بناتی | ہے | ۔,روزانہ ورزش آپ کو فٹ اور صحت مند بناتی ہے۔
میں بدلنے والا ہوں۔,,میں بدلنے والا ہوں۔,5,1,میں | بدلنے | والا | ہوں | ۔,میں بدلنے والا ہوں۔
زین نے دروازہ بند کر دیا۔,,زین نے دروازہ بند کر دیا۔,7,1,زین | نے | دروازہ | بند | کر | دیا | ۔,زین نے دروازہ بند کر دیا۔
اسے ایک وقفہ دو,,اسے ایک وقفہ دو,4,1,اسے | ایک | وقفہ | دو,اسے ایک وقفہ دو۔
یہ میرا خیال نہیں تھا,,یہ میرا خیال نہیں تھا,5,1,یہ | میرا | خیال | نہیں | تھا,یہ میرا خیال نہیں تھا۔
زین آرام دہ اور پرسکون,,زین آرام دہ اور پرسکون,5,1,زین | آرام | دہ | اور | پرسکون,زین آرام دہ اور پرسکون۔
میں فرانسیسی ہوں,,میں فرانسیسی ہوں,3,1,میں | فرانسیسی | ہوں,میں فرانسیسی ہوں۔
میری دائیں ٹانگ میں درد ہے,,میری دائیں ٹانگ میں درد ہے,6,1,میری | دائیں | ٹانگ | میں | درد | ہے,میری دائیں ٹانگ میں درد ہے۔
میں کھونا پسند نہیں کرتا,,میں کھونا پسند نہیں کرتا,5,1,میں | کھونا | پسند | نہیں | کرتا,میں کھونا پسند نہیں کرتا۔
میں کتا رکھتا ہوں۔,,میں کتا رکھتا ہوں۔,5,1,میں | کتا | رکھتا | ہوں | ۔,میں کتا رکھتا ہوں۔
میں اسے ڈانٹوں گا۔,,میں اسے ڈانٹوں گا۔,5,1,میں | اسے | ڈانٹوں | گا | ۔,میں اسے ڈانٹوں گا۔
مجھے لگتا ہے کہ آپ خوبصورت ہیں۔,,مجھے لگتا ہے کہ آپ خوبصورت ہیں۔,8,1,مجھے | لگتا | ہے | کہ | آپ | خوبصورت | ہیں | ۔,مجھے لگتا ہے کہ آپ خوبصورت ہیں۔
ریڈیو بند کرو,,ریڈیو بند کرو,3,1,ریڈیو | بند | کرو,ریڈیو بند کرو۔
پیزا کس کے لیے ہے؟,,پیزا کس کے لیے ہے؟,6,1,پیزا | کس | کے | لیے | ہے | ؟,پیزا کس کے لیے ہے؟
میں کبھی نہیں پیتا,,میں کبھی نہیں پیتا,4,1,میں | کبھی | نہیں | پیتا,میں کبھی نہیں پیتا۔
مجھے اپنے دفتر پیدل جانا ہے۔,,مجھے اپنے دفتر پیدل جانا ہے۔,7,1,مجھے | اپنے | دفتر | پیدل | جانا | ہے | ۔,مجھے اپنے دفتر پیدل جانا ہے۔
میرا مطلب ہے بے عزتی نہیں,,میرا مطلب ہے بے عزتی نہیں,6,1,میرا | مطلب | ہے | بے | عزتی | نہیں,میرا مطلب ہے بے عزتی نہیں۔
وہ تھکا ہوا تھا مگر وہ پھر بھی کام کرتا رہا۔,,وہ تھکا ہوا تھا مگر وہ پھر بھی کام کرتا رہا۔,12,2,وہ | تھکا | ہوا | تھا | مگر | وہ | پھر | بھی | کام | کرتا | رہا | ۔,وہ تھکا ہوا تھا۔ || مگر وہ پھر بھی کام کرتا رہا۔
ہم یہاں بات نہیں کر سکتے,,ہم یہاں بات نہیں کر سکتے,6,1,ہم | یہاں | بات | نہیں | کر | سکتے,ہم یہاں بات نہیں کر سکتے۔
آپ دیکھے دیکھے لگتے ہیں,,آپ دیکھے دیکھے لگتے ہیں,5,1,آپ | دیکھے | دیکھے | لگتے | ہیں,آپ دیکھے دیکھے لگتے ہیں۔
پتہ نہیں وہ آئِں گے کہ نہیں۔,,پتہ نہیں وہ آئِں گے کہ نہیں۔,8,1,پتہ | نہیں | وہ | آئِں | گے | کہ | نہیں | ۔,پتہ نہیں وہ آئِں گے کہ نہیں۔
میں ناچنا نہیں چاہتا,,میں ناچنا نہیں چاہتا,4,1,میں | ناچنا | نہیں | چاہتا,میں ناچنا نہیں چاہتا۔
فکر نہ کرو,,فکر نہ کرو,3,1,فکر | نہ | کرو,فکر نہ کرو۔
وہ میری سہلیاں ہیں۔,,وہ میری سہلیاں ہیں۔,5,1,وہ | میری | سہلیاں | ہیں | ۔,وہ میری سہلیاں ہیں۔
ٹام کے ساتھ رہو,,ٹام کے ساتھ رہو,4,1,ٹام | کے | ساتھ | رہو,ٹام کے ساتھ رہو۔
میں نے خود کو کاٹ لیا,,میں نے خود کو کاٹ لیا,6,1,میں | نے | خود | کو | کاٹ | لیا,میں نے خود کو کاٹ لیا۔
جار کو احتیاط سے کھولیں,,جار کو احتیاط سے کھولیں,5,1,جار | کو | احتیاط | سے | کھولیں,جار کو احتیاط سے کھولیں۔
اسے مت چھو,,اسے مت چھو,3,1,اسے | مت | چھو,اسے مت چھو۔
ہم دوبارہ ملیں گے,,ہم دوبارہ ملیں گے,4,1,ہم | دوبارہ | ملیں | گے,ہم دوبارہ ملیں گے۔
مجھے رعایت چاہیے,,مجھے رعایت چاہیے,3,1,مجھے | رعایت | چاہیے,مجھے رعایت چاہیے۔
اس نے کونے کو موڑ دیا,,اس نے کونے کو موڑ دیا,6,1,اس | نے | کونے | کو | موڑ | دیا,اس نے کونے کو موڑ دیا۔
کیا میں تھوڑا آرام کر سکتا ہوں؟,,کیا میں تھوڑا آرام کر سکتا ہوں؟,8,1,کیا | میں | تھوڑا | آرام | کر | سکتا | ہوں | ؟,کیا میں تھوڑا آرام کر سکتا ہوں؟
میرے پاس کچھ جوتے تھے۔,,میرے پاس کچھ جوتے تھے۔,6,1,میرے | پاس | کچھ | جوتے | تھے | ۔,میرے پاس کچھ جوتے تھے۔
میں آنتوں کے عارضے میں مبتلا ہوں۔,,میں آنتوں کے عارضے میں مبتلا ہوں۔,8,1,میں | آنتوں | کے | عارضے | میں | مبتلا | ہوں | ۔,میں آنتوں کے عارضے میں مبتلا ہوں۔
زین نے کبھی نہیں کہا,,زین نے کبھی نہیں کہا,5,1,زین | نے | کبھی | نہیں | کہا,زین نے کبھی نہیں کہا۔
دوا لے لو,,دوا لے لو,3,1,دوا | لے | لو,دوا لے لو۔
میں ہمیشہ خوش نہیں تھا,,میں ہمیشہ خوش نہیں تھا,5,1,میں | ہمیشہ | خوش | نہیں | تھا,میں ہمیشہ خوش نہیں تھا۔
زین ایک ماہر حیاتیات ہے۔,,زین ایک ماہر حیاتیات ہے۔,6,1,زین | ایک | ماہر | حیاتیات | ہے | ۔,زین ایک ماہر حیاتیات ہے۔
کیا آپ لاطینی جانتے ہیں؟,,کیا آپ لاطینی جانتے ہیں؟,6,1,کیا | آپ | لاطینی | جانتے | ہیں | ؟,کیا آپ لاطینی جانتے ہیں؟
زین اپنی بائیک سے اترا۔,,زین اپنی بائیک سے اترا۔,6,1,زین | اپنی | بائیک | سے | اترا | ۔,زین اپنی بائیک سے اترا۔
مہربانی کر کے ایسا ضرور کریں۔,,مہربانی کر کے ایسا ضرور کریں۔,7,1,مہربانی | کر | کے | ایسا | ضرور | کریں | ۔,مہربانی کر کے ایسا ضرور کریں۔
میں عام طور پر اپنے کمرے میں موسیقی سنتا ہوں۔,,میں عام طور پر اپنے کمرے میں موسیقی سنتا ہوں۔,11,1,میں | عام | طور | پر | اپنے | کمرے | میں | موسیقی | سنتا | ہوں | ۔,میں عام طور پر اپنے کمرے میں موسیقی سنتا ہوں۔
غیر بیمہ شدہ تھے۔,,غیر بیمہ شدہ تھے۔,5,1,غیر | بیمہ | شدہ | تھے | ۔,غیر بیمہ شدہ تھے۔
کیا تمھاری بیوی ہے,,کیا تمھاری بیوی ہے,4,1,کیا | تمھاری | بیوی | ہے,کیا تمھاری بیوی ہے۔
ایک ٹیکسی انتظار کر رہی ہے۔,,ایک ٹیکسی انتظار کر رہی ہے۔,7,1,ایک | ٹیکسی | انتظار | کر | رہی | ہے | ۔,ایک ٹیکسی انتظار کر رہی ہے۔
میں خوش ہو گیا تھا,,میں خوش ہو گیا تھا,5,1,میں | خوش | ہو | گیا | تھا,میں خوش ہو گیا تھا۔
میں ہنسی نہیں روک سکتا,,میں ہنسی نہیں روک سکتا,5,1,میں | ہنسی | نہیں | روک | سکتا,میں ہنسی نہیں روک سکتا۔
